Ratings,Rating Code,Rating Image,Description,Sort Order,Description cn
Everyone,E,https://esrbstorage.blob.core.windows.net/esrbcontent/images/ratingsymbol_e.png,"Content is generally suitable for all ages. May contain minimal cartoon, fantasy or mild violence and/or infrequent use of mild language.",1,"	内容通常适合所有年龄段。 可能包含极少的卡通，幻想或轻微的暴力和/或不经常使用温和的语言。	1"
Everyone 10+,E10+,https://esrbstorage.blob.core.windows.net/esrbcontent/images/ratingsymbol_e10.png,"Content is generally suitable for ages 10 and up. May contain more cartoon, fantasy or mild violence, mild language and/or minimal suggestive themes.",2,"	内容通常适合10岁及以上。 可能包含更多卡通，幻想或轻度暴力，温和语言和/或极少暗示主题。	2"
Teen,T,https://esrbstorage.blob.core.windows.net/esrbcontent/images/ratingsymbol_t.png,"Content is generally suitable for ages 13 and up. May contain violence, suggestive themes, crude humor, minimal blood, simulated gambling and/or infrequent use of strong language.",3,"	内容通常适合13岁及以上。 可能包含暴力，暗示性主题，粗暴幽默，极少血症，模拟赌博和/或不常使用强势语言。	3"
Mature,M,https://esrbstorage.blob.core.windows.net/esrbcontent/images/ratingsymbol_m.png,"Content is generally suitable for ages 17 and up. May contain intense violence, blood and gore, sexual content and/or strong language.",4,"	内容通常适合17岁及以上。 可能包含强烈的暴力，血腥和血腥，性内容和/或强烈的语言。	4"
Adults Only,AO,https://esrbstorage.blob.core.windows.net/esrbcontent/images/ratingsymbol_ao.png,"Content suitable only for adults ages 18 and up. May include prolonged scenes of intense violence, graphic sexual content and/or gambling with real currency.",5,"	内容仅适用于18岁及以上的成年人。 可能包括长时间暴力场面，图形性内容和/或用真实货币赌博。	5"
Rating Pending,RP,https://esrbstorage.blob.core.windows.net/esrbcontent/images/ratingsymbol_rp.png,"Not yet assigned a final ESRB rating. Appears only in advertising, marketing and promotional materials related to a physical (e.g., boxed) video game that is expected to carry an ESRB rating, and should be replaced by a game's rating once it has been assigned.",6,"	尚未指定最终的ESRB评级。 仅出现在与预期带有ESRB评级的物理（例如，盒装）视频游戏相关的广告，营销和宣传材料中，并且一旦被分配，应该被游戏的评级替换。	6"
